{
  "review_id": "Q02-AES-GDL-002",
  "evaluation_question_number": 2,
  "question": "What evidence supports preemptive TEVAR for uncomplicated acute or subacute type B aortic dissection?",
  "source_id": "AES-GDL-002",
  "review_status": "Not started",
  "reviewer": null,
  "review_date": null,
  "source_access_type": null,
  "source_version_or_date": null,
  "relevant_sections": [],
  "extracted_claims": [],
  "guideline_recommendations": [],
  "outcome_data": [],
  "limitations": [],
  "contradictions": [],
  "reviewer_notes": null,
  "last_updated": "2026-07-15"
}
