{
  "review_id":"Q02-AES-RCT-003","evaluation_question_number":2,"question":"What evidence supports preemptive TEVAR for uncomplicated acute or subacute type B aortic dissection?","source_id":"AES-RCT-003","review_status":"Extraction completed","reviewer":null,"review_date":null,
  "source_access_type":"Original publisher PDF held in private local source workspace","source_version_or_date":"Eur J Vasc Endovasc Surg. 2014;48:285-291; appended author-name correction present in PDF",
  "relevant_sections":["Abstract","Patients and Methods","Primary efficacy endpoint","Remodelling","Dissection-related mortality","Study limitations"],
  "study_characteristics":{"design":"Prospective multicenter randomized controlled trial; intention-to-treat primary efficacy analysis","population":"61 patients with acute uncomplicated type B aortic dissection less than 14 days from symptom onset","setting":"17 European centers","intervention":"Best medical treatment plus Gore TAG (n=30 randomized)","comparator":"Best medical treatment alone (n=31 randomized)","primary_endpoint":"Composite of incomplete/no false-lumen thrombosis, aortic dilatation, or aortic rupture at one year","follow_up":"1 year","crossovers":"Three early crossovers from BMT to TAG plus BMT due to progression","source_location":"Printed pp. 285-288; PDF pp. 1-4"},
  "source_identity_validation":{"outcome":"Matched","primary_fields":{"doi":"Matched","pmid":"Matched","normalized_title":"Matched","journal":"Matched","publication_year":"Matched"},"supporting_fields":{"first_author":"Matched","author_overlap":"Matched","trial_or_study_group":"Matched","volume_issue_pages":"Matched"},"metadata_warning":"The supplied publisher PDF appends a correction to a trialist name. The registered original article itself is present and matches the core identity fields; the correction is not a substitute article."},
  "extracted_claims":[
    {"claim_id":"Q02-RCT003-C01","claim_text":"ADSORB randomized 61 patients with acute uncomplicated type B aortic dissection to best medical treatment with or without Gore TAG.","evidence_category":"Published clinical evidence","exact_supporting_text":"Of the 61 patients randomised, 80% were DeBakey type IIIB","page":"Printed p. 285; PDF p. 1","section":"Abstract","table":null,"figure":null,"source_location_note":"Methods on printed pp. 286-287 specify onset under 14 days and allocation 31 versus 30.","direct_or_indirect":"Direct","confidence":"High for extraction; not specialist reviewed","verified_by_reviewer":false,"suitable_for_generated_answer":false},
    {"claim_id":"Q02-RCT003-C02","claim_text":"At one year, the primary composite endpoint occurred less often with TAG plus medical treatment than with medical treatment alone.","evidence_category":"Published clinical evidence","exact_supporting_text":"15 (50.0%) of the 30 TAG+BMT patients had at least one endpoint event","page":"Printed pp. 287-288; PDF pp. 3-4","section":"Primary efficacy endpoint","table":"Table 3","figure":null,"source_location_note":"All 31 BMT patients met the composite; P<0.001. Missing imaging was counted as failure.","direct_or_indirect":"Direct","confidence":"High for extraction; not specialist reviewed","verified_by_reviewer":false,"suitable_for_generated_answer":false},
    {"claim_id":"Q02-RCT003-C03","claim_text":"Incomplete false-lumen thrombosis at one year was less frequent with TAG plus medical treatment.","evidence_category":"Published clinical evidence","exact_supporting_text":"Incomplete false lumen thrombosis was found in 13 (43%)","page":"Printed pp. 287-288; PDF pp. 3-4","section":"Primary efficacy endpoint","table":"Table 3","figure":null,"source_location_note":"Comparator was 30/31 (97%); P<0.001.","direct_or_indirect":"Direct","confidence":"High for extraction; not specialist reviewed","verified_by_reviewer":false,"suitable_for_generated_answer":false},
    {"claim_id":"Q02-RCT003-C04","claim_text":"One-year imaging showed smaller false-lumen and larger true-lumen diameters with TAG plus medical treatment.","evidence_category":"Published clinical evidence","exact_supporting_text":"maximum false lumen diameter was 18.5 mm for TAG+BMT versus 25.1 mm for BMT","page":"Printed p. 288; PDF p. 4","section":"Remodelling","table":null,"figure":"Figures 2 and 3","source_location_note":"Maximum true-lumen diameter was 32.2 versus 25.5 mm; both P<0.001.","direct_or_indirect":"Direct","confidence":"High for extraction; not specialist reviewed","verified_by_reviewer":false,"suitable_for_generated_answer":false},
    {"claim_id":"Q02-RCT003-C05","claim_text":"No aortic ruptures were reported in either randomized group within one year.","evidence_category":"Published clinical evidence","exact_supporting_text":"No aortic ruptures were reported within 365 days","page":"Printed p. 288; PDF p. 4","section":"Primary efficacy endpoint","table":"Table 3","figure":null,"source_location_note":"Reported as 0/30 and 0/31.","direct_or_indirect":"Direct","confidence":"High for extraction; not specialist reviewed","verified_by_reviewer":false,"suitable_for_generated_answer":false},
    {"claim_id":"Q02-RCT003-C06","claim_text":"ADSORB was not powered to determine a mortality benefit, and the authors called for a larger randomized trial with longer follow-up.","evidence_category":"Published clinical evidence","exact_supporting_text":"the ADSORB trial was not powered for mortality","page":"Printed p. 290; PDF p. 6","section":"Study limitations","table":null,"figure":null,"source_location_note":"The preceding paragraph states survival can only be demonstrated with a larger RCT and longer follow-up.","direct_or_indirect":"Direct","confidence":"High for extraction; not specialist reviewed","verified_by_reviewer":false,"suitable_for_generated_answer":false}
  ],
  "guideline_recommendations":[],
  "outcome_data":[
    {"outcome_name":"Primary composite endpoint","population":"Intention-to-treat efficacy population; missing imaging counted as failure","intervention":"TAG plus BMT","comparator":"BMT","follow_up":"1 year","result_text":"15/30 (50.0%) versus 31/31 (100.0%); P<0.001","numeric_result":"50.0% vs 100.0%; P<0.001","page_or_location":"Printed pp. 287-288; PDF pp. 3-4; Table 3","verified_by_reviewer":false},
    {"outcome_name":"Incomplete/no false-lumen thrombosis","population":"Intention-to-treat efficacy population","intervention":"TAG plus BMT","comparator":"BMT","follow_up":"1 year","result_text":"13/30 (43%) versus 30/31 (97%); P<0.001","numeric_result":"43% vs 97%; P<0.001","page_or_location":"Printed pp. 287-288; PDF pp. 3-4; Table 3","verified_by_reviewer":false},
    {"outcome_name":"Aortic dilatation","population":"Intention-to-treat efficacy population","intervention":"TAG plus BMT","comparator":"BMT","follow_up":"1 year","result_text":"11/30 (37%) versus 14/31 (45%); P=0.500","numeric_result":"37% vs 45%; P=0.500","page_or_location":"Printed p. 288; PDF p. 4; Table 3","verified_by_reviewer":false},
    {"outcome_name":"Aortic rupture","population":"Intention-to-treat efficacy population","intervention":"TAG plus BMT","comparator":"BMT","follow_up":"1 year","result_text":"0/30 versus 0/31","numeric_result":"0 vs 0","page_or_location":"Printed p. 288; PDF p. 4; Table 3","verified_by_reviewer":false},
    {"outcome_name":"Maximum false-lumen diameter","population":"Patients with imaging measurements","intervention":"TAG plus BMT","comparator":"BMT","follow_up":"1 year","result_text":"18.5 mm versus 25.1 mm; P<0.001","numeric_result":"18.5 mm vs 25.1 mm; P<0.001","page_or_location":"Printed p. 288; PDF p. 4; Remodelling/Figure 3","verified_by_reviewer":false},
    {"outcome_name":"Maximum true-lumen diameter","population":"Patients with imaging measurements","intervention":"TAG plus BMT","comparator":"BMT","follow_up":"1 year","result_text":"32.2 mm versus 25.5 mm; P<0.001","numeric_result":"32.2 mm vs 25.5 mm; P<0.001","page_or_location":"Printed p. 288; PDF p. 4; Remodelling/Figure 2","verified_by_reviewer":false},
    {"outcome_name":"Thirty-day mortality","population":"Randomized cohort","intervention":"TAG plus BMT","comparator":"BMT","follow_up":"30 days","result_text":"No deaths in either group","numeric_result":"0 vs 0","page_or_location":"Printed p. 288; PDF p. 4; Dissection-related mortality","verified_by_reviewer":false}
  ],
  "limitations":["The trial was not powered for mortality.","Fourteen efficacy failures reflected inadequate imaging or dropout, and missing imaging was counted as failure.","Three patients crossed from BMT to TAG plus BMT within five days because of progression.","Experienced tertiary-center recruitment may introduce selection bias and limit generalizability.","No complete screening log was maintained; more than half of logged candidates were excluded, mainly for anatomical limitations.","The trial was funded by W. L. Gore, and three authors reported consulting relationships with Gore."],
  "contradictions":["The trial demonstrated imaging/remodeling differences but did not establish a survival benefit."],
  "reviewer_notes":"Original-PDF extraction only. The appended name-correction notice was noted but was not used as a substitute source. No claim or outcome is citation verified or specialist validated.","last_updated":"2026-07-15"
}
